"review_name","review_rating","review_title","review_review_text","review_helpful_vote"
"ut","4.0 out of 5 stars","Beautiful Phone","👌👌 bought this phone only 'cause of its in hand feel and a good camera , only thing which worries me is its battery....ah it sucks.",""
"Keshav Kakarla","5.0 out of 5 stars","Just amazing","iPhone 12 is just amazing, now available with more discounts",""
"Amazon Customer","5.0 out of 5 stars","Excellent","Excellent",""
"Shivasai","5.0 out of 5 stars","Worth it every penny","Even with the iPhone 13 offering more speed, slightly better cameras and longer battery life, the iPhone 12 is still among the best phones you can buy overall.",""
"Chayachitrakar","5.0 out of 5 stars","Wonderful phone","Apart from the cost, the phone is fantastic
Tip for those who are shifting from android
The WhatsApp message history is not migrated unless you pay good amount to some third party software and that too is not guaranteed","One person found this helpful"
"manish singh","5.0 out of 5 stars","iPhone is the best phone","iPhone is the best",""
"Jude Soosai","5.0 out of 5 stars","Very good phone.","Looks sturdy. Good features. If you get it under 60k (before offers and exchange) it is worth the cost.",""
"Sarthak S.","5.0 out of 5 stars","Best","Loved it overall",""
"Avishek Sinha","5.0 out of 5 stars","Excellent performance","Best hand on experience, fast smooth with good quality pictures",""
"User","4.0 out of 5 stars","Iphone12","Face recognition sometimes not working.. Didn’t received adapter in iPhone box",""
"S.R.","5.0 out of 5 stars","Outstanding","The phone is awesome. Seamless browsing. I canceled the first order with the seller because it was being delivered too late. The second order was in a deal wherein the delivery was next day. Seems weird but so is life. Phew..",""
"Vikrant Yerkal","5.0 out of 5 stars","Best iPhone","Best iPhone in this price point does every job perfectly camera awesome
Display superb
Battery life whole day
Buttery smooth
Overall- Awesome",""
"Sangita","5.0 out of 5 stars","Superb phone no issues","First of all amazon delivered the phone safely taken the video of the unboxing also which was quite a surprise.
Negative comments was another concern but sometimes it happens but End of the day phone is superb no issues at tall till date.",""
"Rahbare islam","5.0 out of 5 stars","Best mobile","Camera 😍😍😍",""
"Bhagyalekshmi S Panicker","5.0 out of 5 stars","Iphone12 Black 128gb","It’s a really good phone with good battery life and really good to use. This is is my first time shifting to iPhone and I m really enjoying it.","One person found this helpful"
"Mridula Singh Ahluwalia","5.0 out of 5 stars","amazing quality","the phone is amazing , the battery ,the camera , smooth functioning.
everything is perfect",""
"Gayathri Rau","5.0 out of 5 stars","great","great battery life long lasting and face recognition works great with mask also, would definitely recommend!",""
"Abhik","4.0 out of 5 stars","Somehow worth the job","Like : Fast charging.
Dislike : Battery heating issue while charging. Back of the phone is heated after longer use.",""
"Shiju","5.0 out of 5 stars","look","super gud phone",""
"Angrej","4.0 out of 5 stars","Quality is a good deal","Best phone than 13",""
"Rahul","5.0 out of 5 stars","Best in class","As A Apple product it never disappoints you best in class although everything is good but apple have to work on battery and Screen at this price range",""
"Gunjan Gunjesh","4.0 out of 5 stars","Great Experience","Everything is great about the phone except company is not offering charger with the phone and needs to be purchased separately. I think for 60K phone. Charger worth 1.5 k should be given.","One person found this helpful"
"srinu","4.0 out of 5 stars","Very good mobile","Thank you amazon for giving good quality of iPhone 12 green colour. This review after one month very nice condition good battery backup also",""
"CLE","5.0 out of 5 stars","Good phone","great phone",""
"Murali","5.0 out of 5 stars","Good product","Phone working very smooth and fast, camera is awesome and face recognition is also good…over all good and worth product",""
"...who else","4.0 out of 5 stars","Moving from Android to iOS?","Yes, it is a 5 star phone. But if you are moving from android to iPhone please be ready to lose your freedom. There is a lot available on internet to tell you about what you will lose out on. It is like speaking a new language altogether.
Quick image editing, video editing, simple things like making collages, setting custom ringtones, quick editing of alarms, changing WiFi or Bluetooth, toggling location, many more basic features are either absent in iOS or managed in a very cumbersome way. You will miss them if moving from Andriod. Also be ready to lose your WhatsApp chat history. Not impressed by the sound reproduction on bigger speakers via Bluetooth and the very inflexible equilizer.
For some silly reasons Apple is being stubborn on some aspects like standardisation of charging cable even within its own products. The notch at the top of the screen is still the same size it was in 2018.
Rest, there are tons of reviews to praise the phone and I agree with most of them.
Was a bit disappointed the way it was packaged. No foam or bubble wrap.","2 people found this helpful"
"Amazon Customer","5.0 out of 5 stars","Awesome","Previously I use to user finger print to open all my apps but
Now it’s opens
With a giffy sounds like a genie",""
"ankush","5.0 out of 5 stars","##","Superb",""
"Nupur B.","5.0 out of 5 stars","Gift to brother","I gifted this to my brother and he was very happy with this. Also got a good deal on Amazon with around 30% off. Thanks 😊",""
"Rakesh","5.0 out of 5 stars","Original product quick delivery","Original with around 5k less then apple store. I purchased at 60k whereas store was selling at 65k after discount",""
"Krishna u.","2.0 out of 5 stars","Nothing can beats my galaxy ultra","Nothing can beat my galaxy ultra, apple just for porn purposes better privacy","One person found this helpful"
"Parthasarathy S","5.0 out of 5 stars","Ace in smart phone","All best in class",""
"Rajeev bhatnagar","5.0 out of 5 stars","Wonderful experience. As expected. Loved this color. ❤️","",""
"Sateesh kumar Venepally","3.0 out of 5 stars","Adapter","Try to give adapter",""
"shiva","5.0 out of 5 stars","Simply amazing and beautiful","I have been waiting for this phone from last 3 months and finally got it. Loved it 😍",""
"Himanshu K","4.0 out of 5 stars","Wonderful phone","A good phone , i phone standa out of android , a bit difficult to hansle but once you get used to its the best",""
"pranab Samanta","4.0 out of 5 stars","Screen and siri","In single word awesomeness","2 people found this helpful"
"Arunprasad","5.0 out of 5 stars","Very good phone and the delivery was also perfect","Very nice product",""
"Haidar Ali","5.0 out of 5 stars","Uffs it was a dream 🥰💙","iphone always gives you a better experience 💙💙💙 BUT battery backup🥺🥺🥺 I'm very disappointed, ghatiya quality battery backup😭😭😭 AFTER 1 Month review",""
"Visakh","4.0 out of 5 stars","💯💯💯","",""
"Nupur mohanty","5.0 out of 5 stars","Best camera, Best & fast iOS system, Simple operation","The A14-Bionic chip makes it fast operating device, it’s 5G enabled (iPhone 11 lacks 5G), 4K video recording is a additional feature, battery life is a little better than it’s predecessor. The purple & green are the most purchased colours, I had waited for more than 3 months to get the 128 gb purple one. In terms of use it is very smooth and responsive and I just loved it.",""
"Raaja","5.0 out of 5 stars","Good.","Good ..but clarity not so good",""
"Narasimhan","5.0 out of 5 stars","It’s a good phone","It’s a good phone",""
"Shrey","5.0 out of 5 stars","Awesome","Just awesome",""
"Shrikant","4.0 out of 5 stars","nce","bice",""
"Dipanjan Roychoudhary","5.0 out of 5 stars","Perfect replacement for a long time android user","Okay I NEED TO CLEAR a few misconceptions about this phone because i am seeing a lot of negative reviews here which are not true, probably from IOS haters. I have been an android user since 2014 when I got my first phone, after many years i switched to Apple after complaining about their high prices because i was disappointed with Samsung using Exynos processors for their flagship phones in India which causes heating, and Oneplus throwing one cheap model after another every six months.
And trust me guys its amazing. The software is butter smooth, i might never go back to android again. FIRST OF ALL - who said the battery life is bad? I got my phone at 70 percent charge at 2 pm and after 24 hours it was 20 percent EVEN AFTER I KEPT MY DATA PACK ON THE WHOLE TIME.
SECONDLY- why are so many guys reviewing the phone on basis of the charger? everyone knows iphone 12 comes without an adapter. did you people not do your research before buying?
THIRD - the 60 Hz thing does not matter at all, flipping screen is real quick u wont even notice the difference from a 120 Hz in android
and lastly - the AI is so sharp, be it the camera which automatically detects low light or even the face recognition.
overall this phone is worth the high price. i will definitely be using it for 4-5 years. a happy customer here","40 people found this helpful"
"Dilip Ramadas","5.0 out of 5 stars","Good buy","Good phone.",""
"Basudev Ganguly","5.0 out of 5 stars","High quality video recording better than a handicam","In an era when mobile handset is a must in everyday life, there cannot be anything better than an APPLE IPHONE. It is always far far ahead of rest of the android phones. No other phone can match it in terms of its superior quality, features, elegant look and finishing in general and in particular its use as a video camera.",""
"Sanka","4.0 out of 5 stars","Looks better in Black color instead of Blue, overall its fine and sturdy","The device has fallen from me various times but thanks to the sturdiness, the device is fine till now. Camera is good but 64GB is not sufficient these days.",""
"rajesh","4.0 out of 5 stars","Beasttt🔥","Beast🔥
Excellent performance😎","One person found this helpful"
"Shubham sharma","4.0 out of 5 stars","Worth in 2022","Good",""
"Vaishnavi","4.0 out of 5 stars","Amazing battery","iPhone 12 is super fast, sleek, has got great display, and excellent battery.","One person found this helpful"
"PRADEEP SETH","4.0 out of 5 stars","Amazing product","Amazing product",""
"y.kiran kumar","5.0 out of 5 stars","Box and Packing","Everything is ok but Package is not Proper and it's too damaged , and some times my Iphone 12 getting too Hot",""
"Neel A.","5.0 out of 5 stars","Best right now","Great battery life, portrait mode of the camera is amazing, smooth OS, overall worthy if you can grab it in a festival discount!",""
"Pankaj Dhir","4.0 out of 5 stars","Phone is not turning on","Phone was working dinw untill one day when it all of a sudden went black screen went black and now its not turning on I tried all the methods to boot it up, battery status was 60 percent when it turned off now i am worried, no physical damage was there but dont why it stopped functioning. And here in himachal pradesh No service centre is here, have to travle 250Km to get this fixed. It is very sad after spending a huge amount this phone stopped working in just 8 months.","2 people found this helpful"
"Shreyas Zad","5.0 out of 5 stars","One beast of a phone.","I am writing this after a week of my usage with this iPhone 12. I have had the X before and OnePlus 6T as well.
Overall experience of switching to iOS again is so good. The Interface, the speed, smoothness, camera, support, and everything is so well crafter.
I’ll be talking about the pros and cons with respect to the apple standards of course.
Pros:
1. The design is absolutely wonderful, its very very light weight and premium feeling phone with vintage boxy look.
2. The speed, the performance.
3. Camera of course. The normal picture comes out pretty good, they don’t usually need any professional touch.
4. Battery life - I’ll talk about the battery life in day to day life instead of nerdy Screen On Time. I am a doctor and usually don’t play much games on this but I surf web a lot, youtube videos, social media and a lot of WhatsApp and sometimes heavy use for 10% of the time. It can get through one day pretty easily with around 8-9 hr Screen on time, 10hr Stand by time, so you can relate now. Don’t believe that it has bad battery, it has a pretty good battery.
Cons
Nothing much until now.
The back of the phone is fingerprint magnet, attracts a lot of them.
Another concern was the charging adapter which is not provided in the box.","73 people found this helpful"
"Jeet Bania","5.0 out of 5 stars","First iphone? Don’t think, just buy!","Its my first iPhone and I couldn’t be any happier, the experience and privacy features you get with an apple product is top class. The smooth in he OS itself is ✨
I didnt use the camera much, but that works well too.",""
"shazaib","5.0 out of 5 stars","Great product","I was skeptical ordering iPhone from amazon, however when I received it was perfect.",""
"Ravinder","4.0 out of 5 stars","A little disappointed about battery life else everything is awesome.","All features and speed of the apps are amazing on iPhone just a little more battery life could make the user happier.",""
"Abhishek","4.0 out of 5 stars","Amazing","Everything in this phone is gud but battery life is not that of much great","One person found this helpful"
"Shoeb haque","5.0 out of 5 stars","If your buying this kind item check the retail rating","Darshita retails is just awsome i got my package on time and its is genuine but packaging is not good like if are buying an phone around so packaging will be like overall good",""
"Chandan Gowda","4.0 out of 5 stars","iPhone = Kidney","",""
"Brijesh Mourya","4.0 out of 5 stars","Face I'd","Everything is good in this 12 series except that face I'd....face I'd doest work properly while wearing mask😶","2 people found this helpful"
"Rahul Sharma","5.0 out of 5 stars","Good","","2 people found this helpful"
"Vignesh Bhasker","3.0 out of 5 stars","I prefer the 11 or the 12 mini","I have been an apple user for the past 10 years and this is the first phone which is disappointing. I was using the Xr and 11 before this and though of upgrading.
1. If you are moving from an android to iPhone for the 1st time, its a great phone to get in terms of camera, processor, screen quality. But if you are already an existing iPhone user, upgrade only from XR downwards. That is if your are upgrading from a 8/X/XS/XR. If you have a 11, stick to it. Wait for the 13 or budget is not a constraint then get the 12 pro.
2. form factor. Apple has gone back to rectangle brick design that they used in their earlier phones. Now for me this was one the reasons I didn't like the phone. It wasn't comfortable n the hand after being used to the curve of the X and 11 and XR
3. Camera- best camera quality with night mode . u can't go wrong with this camera setup.
4. screen- excellent screen quality , no complaints here.
5. 5g - IS it really that big a deal breaker ? especially if you are in India where 5g seems a long way off.
6. No charging adapter. You either have to connect it to your MacBook or buy a separate power adapter. When ur spending 70 odd grand, that's the least apple could offer.
7. again no ear phones.
8. It somehow doesn't have the wow factor as what the X had.
Update.
I exchange my phone for a 12 mini. much more easier to use with one hand and comfortable.","9 people found this helpful"
"Rahul","4.0 out of 5 stars","Overpriced","Cons:
1.Overpriced phone( which should be around 45k)
2.No Adapter
3.Ugly Layout at the side of screen.( Iphone xs max which i have has better layout)
4.No Telephoto lense at this price seriously a joke","6 people found this helpful"
"Rajkumar B","4.0 out of 5 stars","Wow mobile but small heat issue","Wonderful mobile having some warm heat while using camera and low battery condition",""
"M Azhar","4.0 out of 5 stars","Excellent","Like",""
"Abhijit Srivastava","4.0 out of 5 stars","Nice product.","Hood product but finger print sensor is missing that is huge mistake by apple.",""
"K MALLIKARJUNARAO","5.0 out of 5 stars","Good phone","Good phone",""
"abhilash","5.0 out of 5 stars","Great phone","Great phone",""
"Prasenjit Jha","4.0 out of 5 stars","Its good but if it whould keep fingerprint lock then it whould be so good","Good",""
"GARIKAPATI DUSHYANTH","5.0 out of 5 stars","Performance","Performance is awesome",""
"P KISHORE KUMAR","5.0 out of 5 stars","Awesome phone","This is my first iPhone and I loved it . No words to say. I primarily wanted it for music. And it proved unlike any other phone 🥲",""
"SwaT OP","5.0 out of 5 stars","Best Upgrade","❤️",""
"Er Sumer S Meena","5.0 out of 5 stars","Excellent product","Thank you Amazon for fast and on-time delivery of my apple iphone 12, really it's awasome product feel so excited using it.
But there is no fingerprint protection.","One person found this helpful"
"Amay Kumar Jha","4.0 out of 5 stars","Best Flagship Smartphone","Best Flagship Smartphone In the Segment !",""
"Gumpi","5.0 out of 5 stars","Worth Purchase","Great product.
Good battery life. Good amazon offer on exchange of old iPhone.
Hassle free exchange.",""
"Bhavesh kashyap","5.0 out of 5 stars","Great phone","As expected.. great phone ….. loyal apple user 🤗",""
"Ankush Ashok Gawande","4.0 out of 5 stars","Phone itself","",""
"Ravi choudhary","4.0 out of 5 stars","Full paisa wasool","I like it",""
"Mayuresh Athalekar","5.0 out of 5 stars","Good phone at good price in republic day sale !","Got the phone configuration that I wanted at decent price in republic day sale. Since apple user since many years, it was time to upgrade from iphone 7 to iphone 12, 256 GB config. Didn't find much difference in 13 and 12, so the price I got for 12 was decent balance for the upgrade. Feature wise I miss fingerprint scanner compared to previous version. Not a big fan of facescanner !😟",""
"Murugeswaran","4.0 out of 5 stars","Everything is nice, but getting heat while charging","I like the product and value for money. But heats while charging…","One person found this helpful"
"Anuj raj","5.0 out of 5 stars","Best cameras iphone 12","Very good product's I am totally satisfied this range of iphone 12 camera are so awesome most of the features are very smooth open I love it and thanks to amazon for fast delivery
I really Apriciated this products","2 people found this helpful"
"Venkatesh","4.0 out of 5 stars","A better one","Don't go for it if you really want longer battery","One person found this helpful"
"Sachin Nerurkar","2.0 out of 5 stars","Facing voice issues while video calling even with full network or with broadband.","Facing voice issues while video calling even with full network or with broadband.","One person found this helpful"
"Divyansh srivastava","4.0 out of 5 stars","Due to low battery always be in mind but if you leave that top notch smartphone A14 bionic chip🙌","So till now what concerns me is only the battery and everything by far is top notch and I was a little hesitating before purchasing it since this was my first interaction with the iOS environment but now I am used to it and works fine. Since I am not a fan of too much customization so for me this UI is totally fine. Plus gaming experience was also good till now I played nfs no limit and it works like a champ. I also really like it's ram working since my app in background keeps running without always reloading it when again opened.
One last since I haven't used 120 Hz refresh rate so I can’t tell about it but since my old phone was also no having it so for me it's awesome👌.
Camera is also awesome till now I haven't used it much due to covid but in low light it worked too good no doubt about it:).
Hope this will help someone😁",""
"RAm PAtaniwar","4.0 out of 5 stars","beautiful phone","Beautiful",""
"Tanu","5.0 out of 5 stars","Excellent quality stuff","Product received as described and at a very good price point",""
"chakradhar","5.0 out of 5 stars","thank you apple","product is good only problem is the battery life",""
"Ashish","5.0 out of 5 stars","Awesome performance","Working in a great way!!! Liked it",""
"Aman Srivastava","5.0 out of 5 stars","Intelligence of future","I was an avid android user for past 25 years. This move to IPhone 12 was a calculative yet bolder definitive move.
Let’s look at the some of key pointers here what I saw -
- Stunning design and spectacular OLed display pouring out all the vivid colors
- Smooth app flow and transitions
- Longer battery life 7-8 hrs without automation (best in my usage)
- Camera is just bringing the life out of all the captures you make.
*I am using Apple 20w charger which is insane at charging 20-25 percent in 7 mins. So, In 15 mins, you are having half the battery up. Love the border outlay of this beauty. It’s almost a month of usage and I can boldly say, “The best switch one can make”. I know the price tag is always hefty but then you are choosing a long term reliability. Kudos to Apple Inc and Amazon for amazing delivery in 2 days.
*Please avoid playing Apple Arcade games as they would drain you battery like anything. In my best guess, It is not rightly optimised for it.
*What I come to see is why Apple looked for environmental protection by removing charger and earphones. I guess it should come at a reasonable price then. It really put me off but then you know what the market player is serving.","4 people found this helpful"
"Abi kamal","5.0 out of 5 stars","Colour is vry hot my Girlfriend is vry excited by seeing the fon tat m hpy .Thank u Amazon","Colour is vry hot my Girlfriend is vry excited by seeing the fon tat mean to me a lots if she is m happy …….Thank u Amazon",""
"megha Agrawal","4.0 out of 5 stars","Just Amazed with the display and quality","New Apple iphone 12 is too amazing. I have switched from android (Oneplus 6T) to iPhone.
Below are my reviews after using for 3 days.
Pros: Amazing look, feel, display, very smooth touch and face recognition is ‘the best’. Lot of new features in camera like studio light, night mode etc.
Just 2 cons: Little small in size as compared to oneplus 6T and battery life is upto my expectation.
If anyone really want to switch to iphone, this is a great deal
(P.S. got 14% discount)
#happycustomer",""
"Babu","5.0 out of 5 stars","Happy with the possession","I am loving this product as I use it everyday",""
"Thirupathireddy.Nara","4.0 out of 5 stars","Highly consumed storage","Good",""
"Rajiv Kumar","5.0 out of 5 stars","It’s Apple it doesn’t need any review","It is working perfect as it should be, offline stores scare too much to customers who want to buy online by saying several things, when you ask them for discount which we get here at Amazon or any other online platforms, I was a bit confused too for ordering online. but all goes perfect, timely delivery, good discount. Thanks Amazon.",""
"Amazon Customer","4.0 out of 5 stars","Good","Go for it",""
"Khairul Anam","5.0 out of 5 stars","Awesome product, satisfied","Excellent",""
"Anoop R","4.0 out of 5 stars","VFM","Nice phone to upgrade from Andriod to ios in 2022.",""
"Pradeep","4.0 out of 5 stars","The camera was unbelievable","But no fingerprint",""
"Gaurav Sharma","5.0 out of 5 stars","🎥","Value for money product.My first iPhone experience with Amazon was good 👌",""
"Saptarshi Dutt","4.0 out of 5 stars","Excellent phone, beautiful colour♥️","Excellent phone, only reason I have reduced one star is since Amazon reduced the price by Rs 3000 the day after I received the phone and this really hurts after spending so much of my hard earned money. Exchange value received for my older phone was also pretty inadequate, considering the condition it was in.
Pros:
1. The green colour is gorgeous
2. Cameras are outstanding
3. Battery life is really good, lasts me almost 2 days on a charge
4. Screen is very bright and has vibrant colours
5. Speaker is very loud
Cons:
1. Just nitpicking, but a fingerprint sensor would have been much more convenient during Covid
2. Indian variant doesn't have the mmWave antenna, inspite of being more expensive than the US Variant
Overall, a great buy.
TIP: Please do not buy 64 GB model, unless you have a robust cloud subscription to upload stuff into.","3 people found this helpful"
"Rishav","5.0 out of 5 stars","Wonderful piece of hardware","This the best iPhone currently in the market imo.
Crisp navigation, very nice battery-life, Excellent camera even amazing videography with Dolby HD technology. The face ID works like magic.
Apple went above and beyond with this phone.
The best part? I got almost 30000 INR discount on republic day sale and by availing exchange offer, so got the 128 GB variation for 52000 INR!!!! WORTH IT!!!!!!!!!",""
"Veer","5.0 out of 5 stars","Its a great color but caches dust easily.","This color cashes dust easily even in the back cover, rather than everything is good.","One person found this helpful"
"sundar","5.0 out of 5 stars","No comments simply superb","Liked very much review after a month
Photoa and battery life is awesome
Video stabilize is great","One person found this helpful"
"Bhushan sonawane","4.0 out of 5 stars","Review after one month use","Bought 128 version @62k, it’s awesome. Looks and performance is best.
Camera average when u compare with oneplus
Screen sensitivity average I had to touch 2/3 times
Mobile heating while charging
Look wise good
Speed is also good","5 people found this helpful"
"Ramesh","5.0 out of 5 stars","बहुत सुंदर","बहुत सुंदर पैकेजिंग करो फास्ट डिलीवरी",""
