"review_name","review_rating","review_title","review_review_text","review_helpful_vote"
"Kuldeep S.","3.0 out of 5 stars","Not the Apple I want to bite","Apple is loosing its grip as a premium product. Now it slows down, hangs often, reboots and irritate. It’s slowly becoming just a symbol rather than an actual smart phone.","One person found this helpful"
"Beric Dondarrion","3.0 out of 5 stars","It's an iPhone..","Same old apple. Overpriced phone with standard features. Works well enough.",""
"bikrams","5.0 out of 5 stars","Best Smartphone used till date","Haven’t used a smartphone this good. Would say just perfect for my need. Sometimes I feel likes touch is like butter. Battery works for me 2 days with dual sim usage.",""
"TAHIR HUSAIN","5.0 out of 5 stars","Treat to use iPhone","Perfect product to use without any glitch","One person found this helpful"
"JOBIN JOY","1.0 out of 5 stars","Battery backup is non existent","Battery backup is worst. My 2 year old redmi note7 pro (12k) easily runs one full day with more than 4 hour screen on time. But this new 60k phone almost dies with 2 hour Amazon music. Clearly not worth it. Apart from the 12mp ultra wide camera nothing else is impressive in this comparing to my old phone
. Updated to the latest iOS version. Running in low power mode. Still battery is draining. Since the replacement period is over, totally devastated. To conclude never buy an iPhone ever again. In video Battery charged to 96%. But after restarting the phone it shows 100%.","20 people found this helpful"
"Amazon Customer","5.0 out of 5 stars","Good Phone","Good Phone",""
"Manu Jain","3.0 out of 5 stars","Not much of difference from predecessor.","If you have iphone 11/XR not much of a change expect the change in look from outside . From inside its still functions the same.
Battery like : Can be improved. Okayish currently.
Value of money: Not really. 80k INR is a lot of money.","2 people found this helpful"
"Amazon Customer","5.0 out of 5 stars","Value for money","Nothing to dislike",""
"Amazon Customer","3.0 out of 5 stars","Working fine","Working fine as of now",""
"Raj","5.0 out of 5 stars","It’s amazing phone","It’s amazing phone",""
"Sandeep Sharma","5.0 out of 5 stars","As usual good work by apple","Loved it",""
"Madhurima Roy","5.0 out of 5 stars","Best phone hands down","Apple is the best there is",""
"Prabal Pathak","5.0 out of 5 stars","Beast at everything","Great phone,Great camera,
great body. Liked everything about the phone,great battery backup,feels so premium in hands.",""
"Preran up","5.0 out of 5 stars","Good one","You can trust Amazon 👍
I am writing this after a week and it’s original apple product
Thank you Amazon 👍",""
"Preceline George","5.0 out of 5 stars","Superb","Good smartphone","One person found this helpful"
"ravi","5.0 out of 5 stars","Great","Great",""
"Preeti","3.0 out of 5 stars","Nice","Nice and costlier product without accessories",""
"Rajat Khurana","5.0 out of 5 stars","A fantastic phone","It's super responsive and has a great display","One person found this helpful"
"Amazon Customer","5.0 out of 5 stars","Great phone but no accessories included.","It’s unfair that they don’t include a charger and headphones, what rip off in the name eco friendly…",""
"Amit","5.0 out of 5 stars","Stylish Look","Sound quality",""
"Mahabala","5.0 out of 5 stars","VERY NICE PHONE","Very good product. I was using 6S plus till now. After using for one and half month, it’s so impressive and battery is the best. It comes whole day. Very fast and smooth. Nice design.","3 people found this helpful"
"flex","5.0 out of 5 stars","Awesome","Love it",""
"Narasimha.mekala","3.0 out of 5 stars","Not Good mobile","Sound quality Excellent battery life excellent.pathetic picture quality not good mobile videos watching picture very bad camera picture is not good colours not accurate",""
"Amazon Customer","5.0 out of 5 stars","Awesome phone…","Camera quality, light weight and smart size of this smartphone makes it superior over its competitors.",""
"Ravi","1.0 out of 5 stars","Don't buy from Amazon","Don't buy this phone from Amazon . I got heating issue on this phone and when I reached the customer service they before the warranty , then they expected the letter of proof from Apple , even I shared that . The Amazon customer service people will give false promises .and and simply waste the time , and will never replace the item
. I think someone who got their first iPhone on Amazon gives good rating. I had conversation with Apple customer care , they are getting multiple calls for iPhone bought from Amazon . Seems Amazon got all defective products from Apple and sold . When we go to Apple service centre , they are ready for service for this defective products.","7 people found this helpful"
"Mohammad Shariq","5.0 out of 5 stars","Mind blowing phone","Superb","One person found this helpful"
"ARVIND DEVASHISH TOPPO","5.0 out of 5 stars","Best experience ever","Best decision i made",""
"Ashu goel","5.0 out of 5 stars","Super HIT phone","Brilliant in all the way. Good performance",""
"avinash chandra","5.0 out of 5 stars","Superb","Superbbb phone.First time I am using I phone feeling better experience with I phone 12.if u will use i phone 12 then u never buy stupid oppo Vivo like android phone","One person found this helpful"
"Arun","5.0 out of 5 stars","Good","Personal use for this like",""
"pArt","5.0 out of 5 stars","Superb phone at a good deal","Superb phone from apple what can I add more to the fact. Though I miss a fingerprint sensor dearly.","One person found this helpful"
"AKHILESH PAL","4.0 out of 5 stars","EVERYTHING Is fine EXCEPT CHEATING OF BATTERY LIFE,CHARGER,EARPHONES. APPLE MUST SHOULD INCLUDE","GOOD PHONE",""
"chandramani kumar","1.0 out of 5 stars","DEFECTIVE PRODUCTS !!!!!! - iPhone 12 !! Be Aware !!","Amazon is selling defective products (iPhone 12) on discount!!!!!!! BE CAREFUL WITH BIG DISCOUNT ON COSTLY PRODUCTS SUCH AS iPhone. Once you perches it you are in trap and there’s no solution AT ALL. Just keep calling costumer care but nobody will help you with this and at the end, Costumes have to suffer for Sure!!!!","One person found this helpful"
"MD RAHBAR ISLAM","5.0 out of 5 stars","Good","Very good",""
"Surojit Pal","5.0 out of 5 stars","Best phone in the world","Excellent phone",""
"Vinit Pandey","5.0 out of 5 stars","Smile","I am happy with my first iPhone 12.
Charger is not in box",""
"Rahul Gandhi","1.0 out of 5 stars","Product Damage","Scratches on the back of phone","One person found this helpful"
"shysun","5.0 out of 5 stars","Awesome","Lovely phone and better body design",""
"Ashif Hussain","4.0 out of 5 stars","Scratch display","Everything is ok except a small hair scratch on front display glass.","One person found this helpful"
"Vartul","5.0 out of 5 stars","Worth it.","Worth it.",""
"Krishanu Mukherjee","5.0 out of 5 stars","Make in India 🇮🇳","Thank you Apple Inc. and Amazon. It is worth for each penny. Kudos to you guys and yes it is assembled in India ❤️","5 people found this helpful"
"DEBASISH NAYAK","5.0 out of 5 stars","Wow","Superb","One person found this helpful"
"Monika","5.0 out of 5 stars","Awesome","Awesome product","One person found this helpful"
"Tucker","1.0 out of 5 stars","Worst product. Don't buy from any online seller especially RKLLP","Very bad product. Cheating the customer by delivering repaired devices. After upgrading software my phone is not turning on. RKLLP seller please don't send the non working device to the customer and your service is really worst. Please visit the apple store and buy the product","2 people found this helpful"
"Sahil Ahmed","5.0 out of 5 stars","It’s awesome! And original product","It really awesome product but the delivery time is late. Try under your own risk.",""
"Anuj masand","5.0 out of 5 stars","Good","Nice",""
"TALIB MALIK","5.0 out of 5 stars","New Apple iPhone 12","Good product",""
"Supratim","5.0 out of 5 stars","A phone beyound words...","Nothing much to say about an iPhone 12. Its brilliant and my all-time favorite.","One person found this helpful"
"Jitendra Verma","3.0 out of 5 stars","Very bad","Very bad charger and ear phone not put on the box",""
"Amazon Customer","4.0 out of 5 stars","Wrost part of ceremic shield","They called ceremic shield but it’s not for scratchless!!!!! I have so many scratches in my phone.......pls use tempered glass for protection of scratches!!!!!","34 people found this helpful"
"washid","5.0 out of 5 stars","Good","Very nice",""
"Abhay Pratap Singh","5.0 out of 5 stars","Battery life and camera","Battery life is good, lasts for 8-10 hours once fully charged
Screen quality is really great","One person found this helpful"
"Prashant Kumar","1.0 out of 5 stars","Front camera not good","Front camea not good",""
"Pavam Sarkar","5.0 out of 5 stars","It’s a gorgeous device in your hand","It has the best haptics!!!",""
"A S","5.0 out of 5 stars","Blast past fast","Buttery smooth. Overall experience is very nice.",""
"Richa Sengupta","5.0 out of 5 stars","I am loving it","As usual apple is best in its segment. Flipkart delivery was smooth and fast within 24 hrs .",""
"Avdhesh kumar","5.0 out of 5 stars","Awesome phone","Beautiful phone",""
"Irfan Shaikh","5.0 out of 5 stars","Pretty good with HDFC card offers","Disappointed with no charger and no headphones in the box.",""
"Swati Mondal","4.0 out of 5 stars","Great","Everything is good but battery life is poor.","2 people found this helpful"
"S D","5.0 out of 5 stars","If budget is not the concern go for it","It’s apple. Its the best there is",""
"Pratik","3.0 out of 5 stars","Disappointed","After 1-2 months use camera ring colour damage..",""
"jasaswini mishra","5.0 out of 5 stars","Awesome","good to have an iphone",""
"Anonymous","5.0 out of 5 stars","Simplicity with best design, holding the best phone ever.","The delivery experience was really good and fast.Best price from Amazon.",""
"Sanjay Yadav","5.0 out of 5 stars","Amazing phone","Just amazing",""
"Hakim patel","2.0 out of 5 stars","Sum scratch on side body","New phone but like old
sum scratch on side body",""
"vishal","5.0 out of 5 stars","Loved the color","Loved the color.",""
"Ankush Dabra","5.0 out of 5 stars","Awesome","Fantastic switch over from android to ios",""
"Amazon Customer","5.0 out of 5 stars","Delivered on time! And i am happy I bought this! It’s an amazing phone!","",""
"Amazon Customer","5.0 out of 5 stars","The piece is per it's claim.","Everything is as per the declaration.",""
"Abir kumar","5.0 out of 5 stars","Light weight","The two important feature I like abt it are light weight and very comfortable to hold.Battery lasts easily for a day.",""
"Kunal giri","5.0 out of 5 stars","Best in gaming and camera quality","Best camera quality,screen resolution superb,battery performance for me like i also play highly graphics games (best in class).premium looks great performance,what else we want ✌🏼","4 people found this helpful"
"Rangz","5.0 out of 5 stars","Simply Superb","Simply superb. Best iPhone till date. It is flawless, but yes, battery could have been improved.",""
"Deepak Rai","2.0 out of 5 stars","Getting warm and low performance","Product is getting warm.. also pictures are very low resolution..getting scattered
This was my third iPhone…really disappointed
Wasted approx 80k .. Apple has now selling it around 65K
Not a god experience …will switch to another brand next time after having 10 years of attachments","2 people found this helpful"
"Keshav singh","5.0 out of 5 stars","Iphone at its best","There is nothing to dislike in this iphone",""
"HARSH","1.0 out of 5 stars","Worst experience","Do not buy this product from Amazon.if any issue occurs within 7 days Amazon do not replace this item as per written agreement in product description they ask you to connect to apple customer care and apple ask you to visit service centre.","One person found this helpful"
"pravin","1.0 out of 5 stars","Damage product delivered | Totally disappointed","On mobile screen already scratches are present,i have tried to contact Amazon care & they are saying our system not accepting this image & denied to replace this mobile. This is totally disappointed.","One person found this helpful"
"Shubhan D.","5.0 out of 5 stars","Paise to zindagi bhar kamaoge","Badhiya hai, ek baar to lena chahiye",""
"Sarang","5.0 out of 5 stars","iPhone 12","I liked it too much🥰🥰🥰",""
"Swarali","5.0 out of 5 stars","Another Amazing phone from Apple","Another Amazing phone from Apple.
Better performance, nice battery, amazing camera.
Just one concern, apple should have given adopter too.","One person found this helpful"
"Ranveer","5.0 out of 5 stars","NYC over all","NYC experience",""
"Shivam Upadhyay","5.0 out of 5 stars","Worth 80k. Awesome.","Awesome product. won’t regret for 80k after buying",""
"Rahul Sidharthan","5.0 out of 5 stars","Beast of a device","Smooth, clean , fast,simple and class.
Except for the front camera which is a bit underwhelming to me considering the price point and brand value,this is a beast of a device.",""
"Shuvam saha","5.0 out of 5 stars","Iphone 12","Product was to good",""
"Yash c.","5.0 out of 5 stars","GO FOR IT","Great phone!",""
"Jeyaram","5.0 out of 5 stars","Be(a)st","Best of the best",""
"JK","5.0 out of 5 stars","Good buy and recommended","iPhone is always and iPHone. Very good CX and UX and trouble free usage. Camera this time is Super clear. Loving it !!",""
"Saurabh","5.0 out of 5 stars","Best mobile","Apple gives what we pay",""
"N","4.0 out of 5 stars","Op","Very op",""
"Rajasekhar","2.0 out of 5 stars","Not worth the money","Battery life is just ok
Camera is average
Front is below average",""
"Ravi k.","5.0 out of 5 stars","Awesome","The iOS experience is just unreal.the optimisation of the system is top of the world.mine was made in India unit.❤️❤️",""
"Bibin jose","1.0 out of 5 stars","Touch is rsponsing inconsistently after 5%","At the first day of usage the touch was not responding properly it was functioning itself, i haved visited thenearest i care and they have taken it for further review to main service centre i have to wait oneweek to get it repaired . Its a disapponiting partfron such a brand","One person found this helpful"
"sridhar","5.0 out of 5 stars","Camera","Best one!
camera🔥❤️
Some pictures taken in very minimal lighting!","One person found this helpful"
"Mohammed Ibraheem","1.0 out of 5 stars","Android is better","Go for android",""
"Ayush Gajbhiye","5.0 out of 5 stars","Best in all. Best camera, Decent battery, great display awesome speakers","",""
"Avinash Yadav","5.0 out of 5 stars","Good","Good smartphone better performance with A14 Bionic.",""
"Laxman","5.0 out of 5 stars","Loved it","The camera could have been better but still great pictures",""
"kushal Ranga","5.0 out of 5 stars","Amazing Product . but not for gaming purpose","Amazing product go for it . Love it . No problem at all","One person found this helpful"
"Hitesh Sharma","5.0 out of 5 stars","Best iPhone ever","",""
"Amazon Customer","5.0 out of 5 stars","Iphone is Iphone","Display quality is awesome. Camera quality good. It's Iphone, nothing else to describe",""
"Sheetal","5.0 out of 5 stars","Great Phone","Upgraded to iPhone 12 and guess what? Not at all disappointed.. Apple has done a great job and iPhone 12 has everything you need.
Go for it without a doubt..",""
"𝗧𝗘𝗝𝗘𝗦𝗛","5.0 out of 5 stars","Excellent","It’s an iPhone it’s always grateful on hands!!!",""
"Rakesh Kumar gupata","5.0 out of 5 stars","Good product","Good product value for money",""
"Dr Siv","5.0 out of 5 stars","Bye bye android","Switching android to iPhone! No regrets! Happy customer!",""
"Shrey and Anuj","5.0 out of 5 stars","fingerprint magnet","i have upgraded from iphone 6 to 12 so for me it is best","One person found this helpful"
"ravikanth reddy","1.0 out of 5 stars","Horrible","Horrible",""
"Amol Sibal","5.0 out of 5 stars","Awesome product","Awesome product",""
"Dhrubajyoti Deka","5.0 out of 5 stars","Must buy beauty !!!","Too good a phone !!! Light, beautiful and elegant !!!",""
"Sujay Adak","5.0 out of 5 stars","Awsam","It isy 1st I phone nice phone",""
"Muthuparvathi","5.0 out of 5 stars","Nice product","Overall very good product",""
"Poonam Chauhan","5.0 out of 5 stars","All is good","Nothing can be better than this. I am on top of the world now with this iPhone XII",""
"Raj","3.0 out of 5 stars","Apple what are you doing? No adapter in the box, this is thug life apple.","This phone is little bit expensive and the baddest thing there is no charging adapter on box, apple charging this much money for this phone without giving important accessories like charging adapter, 😡","10 people found this helpful"
"lavan kumar","5.0 out of 5 stars","Good","Performance was great",""
"Buyer","5.0 out of 5 stars","True Beauty.♥️💟♥️","Once an iphone lover, always an iphone lover.
The phone is great with smooth user interface, suits basic needs and has a great camera quality.",""
"Sarath","5.0 out of 5 stars","Worth","Very got",""
"Divakar Vikramjeet Singh","5.0 out of 5 stars","Buy if your older iPhone is not iPhone11","a Good phone but if you have iPhone 11 then there is no need to upgrade to iphone 12.",""
"Sunny Singh","5.0 out of 5 stars","Design","Wonderful experience, i have no words for the product to explain his efficiency design.","One person found this helpful"
"Aryan shukla","5.0 out of 5 stars","I love it…","I like it…..","One person found this helpful"
"Ricky BOI","5.0 out of 5 stars","Fabulous phone Value for money","Great phone",""
"Harshvardhan singh","5.0 out of 5 stars","Unbelievably good!!!","Absolutely loved it....everything about it is just mind boggling",""
"Lakshaman","5.0 out of 5 stars","Nice","Nice and super","One person found this helpful"
"Meraj Ahmad Khan Business account","5.0 out of 5 stars","Best phone as per expections...white colur is amazing.","",""
"Mahesh Siddalingappa","5.0 out of 5 stars","Superb Phone","Product is awesome and worth buying.","One person found this helpful"
"Eva","5.0 out of 5 stars","Good product","Good product.",""
"Satpal Verma","5.0 out of 5 stars","Safe to buy on Amazon it’s 3rd time I bought iPhone here","You all know about the product and it’s features. Here I am writing about Amazon is trusted you can buy IPhone here without any hesitations.",""
"shekhar sharma","5.0 out of 5 stars","Class","Class",""
"Customer","5.0 out of 5 stars","Amazing","",""
"Venkatrao","3.0 out of 5 stars","Ok","",""
"Ashay","5.0 out of 5 stars","Awesome","The best iPhone till now. Display, camera, performance",""
"Kandaswami Aravind","5.0 out of 5 stars","Trusted good suppliers early delivery","Good Product. Very good supplier. Earlier delivery with quality packing",""
"Soumen Ghosh","5.0 out of 5 stars","Best iphone ever by Apple Inc.","Original iPhone 12, assembled in India. With good face recognition capabilities and good battery 🔋 life.","One person found this helpful"
"Ashok K Alexander","5.0 out of 5 stars","Good Quality Product","After three months, the phone is performing well. There have been no problems. All the features are working well.",""
"Mukul b.","5.0 out of 5 stars","Best iPhone ever","I’m using iPhones since long time & this one is the best ever iPhone. Battery is decent but otherwise it’s top notch.",""
"sandeep kumar","5.0 out of 5 stars","Definitely go for it","Great experience so for , my first iPhone,",""
"Ganesh","5.0 out of 5 stars","Awesome","Product is awesome but at continue using of this phone going to hot","One person found this helpful"
"Rohit Singh","5.0 out of 5 stars","amazing product","",""
"Rao","5.0 out of 5 stars","iPhone on its original flavour","The best iPhone I’ve ever had",""
"Barnie Jose","5.0 out of 5 stars","🔥🔥🔥","Nice phone Got it around 72.5k effective price after cash back.",""
"Ruthvikraj","5.0 out of 5 stars","iPhone 12","All good",""
"Mitesh parmar","1.0 out of 5 stars","Dislike","Dislike battry persontage is riduced😥",""
"Dilip","5.0 out of 5 stars","Excellent performance","Excellent",""
"Vairamudi M","5.0 out of 5 stars","Mobile with perfect of every one","Amazing...... Excellent..... Easy to handle....",""
"PARLE KALYAN CHAKRAVARTHY","5.0 out of 5 stars","Nice","Good",""
"Rohit Kheraliya","5.0 out of 5 stars","Awesome phone","Nice phone with awesome brand.",""
"manoj","3.0 out of 5 stars","Power key not working after 20 day use","My phone power key not working after 20 days use ..now m helpless where m going for bacause amazon gives 10 day replacement only and iphone store so far from I’m lived","2 people found this helpful"
"INDRAJIT PAL","5.0 out of 5 stars","Great mobile to use!!!","Everything is quite fine but only matters is battery backup is very low.
Hardly for a normal user it lasts not more than18-20 hours","One person found this helpful"
"Umesh Yadav","5.0 out of 5 stars","Okay","Okay",""
"Sandeep pandey","5.0 out of 5 stars","Nice","Good phone","3 people found this helpful"
"Kalyan.M","5.0 out of 5 stars","Camera","NA",""
"PATEL PRIYANK","5.0 out of 5 stars","GOOD QUALITY PHONE","GOOD QUALITY
GOOD PRICE AMAZON",""
"Sudhir","5.0 out of 5 stars","Excellent","No comparison",""
"Rohan Kotecha","5.0 out of 5 stars","Lovely product","As usual, apple products are upto the mark. Extremely efficient delivery by Amazon...keeo it up guys","One person found this helpful"
"govind solanki","5.0 out of 5 stars","Very good if only want iOS","If you only want an iOS you go for it or else you can buy Asus rog 5",""
"Anshul","5.0 out of 5 stars","Best Phone","Apple user will always love an upgrade and new user will be delighted.
I am loving this upgrade.",""
"RASHMI SINGH","5.0 out of 5 stars","Must Buy","Quality justified",""
"Dr Amit sharma","5.0 out of 5 stars","100% Original, No issues found","It’s nice and 100% genuine iPhone 12… Writing review after using for 10-12 days",""
"kunal dhaked","1.0 out of 5 stars","Want replacement","The phone worked fine for 10 days after that the phone started heating and after that the charging was slow and now its 1month and the phone's speaker is not working .. i have given 84000 for this product to your company and i have called ur support system but they have told me to go to apple service center..
I have taken the phone today and they have told me that it will take 7 days to fix it .. but my point is that i want a new phone or i want my money back as i m not 1% satisfied with ur product and customer service so plzz dnt put ur company name down and provide me a new phone if the phone dosent satisfy me after the phone is returned to me by the apple service center . Or else i will go to consumer court .. plzz call me as soon as possible and provide me a proper reply and if i dont get any solution that is good to me then i will file an case in the consumer court .","9 people found this helpful"
"milan mali","5.0 out of 5 stars","I phone 12","sir thank you it is a very nice phone",""
"AM","5.0 out of 5 stars","The phone to buy","12 vanilla is the phone to buy for the average user. Its the sweet spot for 🍎 fans. If you really want the 3 cameras go for the pro max.","3 people found this helpful"
"amarjeet","5.0 out of 5 stars","Amazing","Amazon with amazing delivery and excellent product. Best app for shopping electronics items.",""
"Amazon Customer","5.0 out of 5 stars","iPhone is iPhone","Love it",""
"gopalakrishnan","5.0 out of 5 stars","Good","Super",""
"Sagun mandi","1.0 out of 5 stars","Display damage","Display damage",""
"vishnu","1.0 out of 5 stars","Touch screen stoped working in 5 days of purchase","I bought this iPhone 12 128 GB after 3 days slowly letter b stoped working on keyboard I thought it was software glitch as sometime updateing software would solve the issue as we are in a pandamic situation I moved to my village where there little reception so update took 2 to 3 days to download. But even after updating there was no improvement so called apple support spoke to then at length about my situation and after hearing me they did some troubleshooting and came to a conclusion that it has some hardware problem and should approach Amazon as they were responsible for selling me this product for replacement. by this time 7 days completed and according to the Amazon policy they only return and replace for 7 days. When spoke to Amazon customer care they just wouldn't connect me to the concern department they just bluntly say I should approach apple but apple executive tells me he can't do anything. Is this how you treat a loyal customer you can check my account the and frequency I order trough Amazon. Not even connecting call to the concern department.","9 people found this helpful"
"Rajesh Kumar","5.0 out of 5 stars","New iPhone 12","Charger and battery is not good",""
"Rajesh Gokhale","5.0 out of 5 stars","Best buying experience","There's enough written about the iPhone already, what I liked was the user experience of buying from Amazon rather than from a store.",""
"Niladri","5.0 out of 5 stars","Good Phone","Most beloved phone of mine",""
"Aniket Kushwaha","5.0 out of 5 stars","Impressive design and brilliant camera","Awesome beast❤️🔥",""
"Shashwat sahil singh","5.0 out of 5 stars","Awesome","As expected by apple.
Apple the name is enough",""
"Camelia Mondal","5.0 out of 5 stars","The colour looks magnificent","It was a very good purchase at such a good discounted rate",""
"sumit shahi","5.0 out of 5 stars","Charging cable does not work","The charging cable is not working.. how do I replace it",""
"Ashwin Menon","5.0 out of 5 stars","My wife loves it!!","","10 people found this helpful"
"sahil mangal","5.0 out of 5 stars","Genuine product","Iphone12 exactly how it should be",""
"Anita Thakur","5.0 out of 5 stars","Nice Camera. Battery life long. Over all very good phone.","Good camera",""
